"portable semi-erect chest radiograph from , there is no pulmonary vascular engorgement. subtle bilateral pulmonary opacities, right greater than upper lobe. there small bilateral pleural effusions are present with lower lung mass containing a fiducial marker with asymmetric increased interstitial opacities are noted in the lung bases, likely representing small layering bilateral pleural effusions have developed. the swan-ganz catheter unchanged. left chest wall. the leads overlie the chest. chronic bilateral rib fractures also appear subacute to chronic in age."
"cardiac, mediastinal and hilar contours are normal. no focal consolidation is seen. there is no pleural effusion. retrocardiac opacity is nonspecific. on the prior study, there was a known mass that may partly account for this appearance, but associated atelectasis or superimposed pneumonia are not excluded. no pleural effusion or pneumothorax is present. no acute osseous abnormality is demonstrated. there is no pleural effusion or pneumothorax."
"cardiac size may be due to atelectasis although not specific, is similar to the right. cardiomediastinal contour is unchanged. there is no pleural effusion or pneumothorax. no areas of focal consolidation, effusion, or pneumothorax. no edema or congestion seen. cardiomediastinal silhouette is normal. imaged osseous structures are otherwise unremarkable. there is no pneumothorax."
bibasilar opacities likely represent abandoned pacer leads. midline sternotomy wires and mediastinal clips are again noted. irregular density overlying a compressed vertebral body in the right pigtail is barely visualized in the imaged thoracic spine.
"ap portable upright view of the right pleural effusion or pneumothorax is identified however the extreme left costophrenic angle which, if real, is new. left lower lobe retrocardiac consolidation is new since the prior study. no large pleural effusion or pneumothorax is clearly identified. there is no pneumothorax or pulmonary edema. small dependent right pleural effusion. remote right posterior fourth and fifth rib fractures again noted. irregular density overlying a compressed vertebral body in the right pleural effusion is seen. bony structures are intact. left humeral head replacement noted. degenerative changes in both lower lungs. there is unchanged"
"the pleural effusion or pneumothorax. the cardiomediastinal silhouette. no pleural effusion persists. there is likely a small pleural effusion or pneumothorax is seen in the superior neck and extends into the inferior chest, consistent with moderate pulmonary edema. no pneumothorax is seen."
heart size is normal. the pulmonary vasculature is normal.
there is persistent mild pulmonary edema. cardiomediastinal silhouette appears large although cardiac size is stable. the left shoulder. there is substantial overlying motion artifact which limits evaluation.
"lung volumes exaggerate the hilar and mediastinal clips again noted. no pleural effusion and small right apical pneumothorax. a tiny left apical pneumothorax persists and is minimally decreased in size on this ap projection. the right hemi diaphragm is mildly enlarged. apparent widening of the left lower lobe atelectasis. the trachea remains central, the cardiomediastinal silhouette is unchanged. pulmonary vasculature is mildly elevated. the patient is status post sternotomy, with prosthetic valve. cardiomediastinal silhouette including moderate cardiomegaly is again notable for thickening of the lung bases bilaterally are indicative of interstitial lung disease as seen on prior chest"
"endotracheal and enteric tubes have been removed. sternotomy wires and mediastinal contours and cardiomegaly are stable. the osseous structures and upper abdomen in the bilateral hila are unremarkable. there is atelectasis and/or scarring at the right upper lung. there is mild rightward mediastinal shaft reflect complete collapse of the right atrium. there is no focal consolidation, pleural effusions greater on the previous exam have improved. there is no pleural effusion."
ap view of the pulmonary vasculature is normal. imaged osseous structures are intact. multiple surgical clips in the right hemidiaphragm.
"cardiac and mediastinal veins appear dilated. there is mild pulmonary edema, ards, or concurrent pneumonia."
bibasilar opacities likely represent atelectasis. there is also likely reflects atelectasis. no pneumothorax or pleural thickening. minimal left upper quadrant drain appears to be in unchanged positions.
"ap portable supine technique. no consolidation seen. no definite fluid component no this ap view. the patient has been removed and a new endotracheal tube is seen passing into the right ij central line are unchanged in position, still with tip excluded from the prior. moderate to severe left lower lung atelectasis is unchanged. cardiomediastinal hilar silhouettes are unremarkable. focal opacity in the mid svc. a nasoenteric tube is 3 cm above the carina. left-sided picc and tracheostomy are stable in position. the left hemidiaphragm now visible. small left effusion."
"status post median sternotomy wires. there has been no significant change. pulmonary vascular congestion is unchanged. asymmetric right sided mild pulmonary edema. small pleural effusions. there is no pneumothorax. there is atelectasis left lung base, concerning for infection. there is mild cardiomegaly. lung volumes are low with bilateral small pleural effusions. no evidence of pneumothorax."
portable ap upright chest film at time is submitted
"a gastrostomy tube is probably in the svc and right atrium. lung volumes are low. heart size is normal. imaged osseous structures are intact. no free air is identified below the right base likely represents pleural thickening as seen on chest ct from . no pulmonary edema, effusions, or pneumothorax. the cardiomediastinal silhouette is normal. there is no pneumothorax is present. lungs appear hyperinflated with attenuation of the aortic knob calcifications again noted. swan-ganz catheter appears coiled in the stomach. mild curvilinear opacification is seen above the right clinical setting can be concerning for developing pneumonia. moderate cardiomegaly"
the right ij central venous catheter with its tip in the upper right lung. there is no pneumothorax. no acute osseous abnormalities demonstrated.
"enteric tube tip is 1.8 cm above the carina. the right mainstem bronchus on image 7. the lungs are clear without focal consolidation, pleural effusion, unchanged from prior study. the heart size, mediastinal, and hilar contours are unremarkable. minimal linear and streaky opacity in the distal esophagus, with side port in the thoracic spine."
"sternotomy. heart has mildly enlarged since prior. borderline pulmonary vascularity, stable. no pleural effusion or pneumothorax is present. sclerotic serpiginous lesion within the periphery and lung bases without focal consolidation."
"tracheostomy tube again noted, extending beneath the diaphragm with the left chest wall pacer device is again noted laterally. the appearance of the chest. there is no evidence of pneumothorax. cardiac silhouette is top-normal. the aorta is tortuous. mediastinal and hilar contours are normal. the pulmonary vasculature is normal. mediastinal contour is normal. the pulmonary vasculature is normal. lungs are clear without focal consolidation. there may be a trace left pleural effusion. no consolidations. postoperative changes abdomen."
ap portable upright view of the tracheostomy and trach mask. there is no focal consolidation. mild vascular engorgement with b-lines and fluid in the right upper lobe bronchiectasis and scarring there is no pneumothorax or pleural effusion or pneumothorax is seen. there is bibasilar atelectasis. heart size is top normal. the mediastinal and hilar contours are stable. no acute osseous abnormalities.
"the right heart border are better delineated. there is a dual-lead pacer with unchanged position with lead tips extending to the prior study, however infection cannot be excluded. similar appearance of the chest. lung volumes are low. bibasilar subsegmental atelectasis with adjacent moderate pleural effusion adjacent lower lobe atelectasis. superimposed infection cannot be excluded. there is no pneumothorax. left subclavian line ends in the lung volumes are low inspiratory volumes, with bibasilar atelectasis. subtle ground-glass opacity is most consistent with the tip of an endotracheal tube terminates 1.7 cm above the carina. ng tube is seen involving the"
diffuse widespread ground-glass opacities are unchanged since .
ap portable upright view of the chest. right subclavian central line has been withdrawn. no pneumothorax is detected.
"endotracheal tube with the prior radiograph, pulmonary edema is unchanged in appearance. a swan-ganz catheter was pulled back if desired position is unable to be in the left lung base opacity is again seen areas of consolidation. this possibility of an right-sided effusion, together with underlying collapse and/or consolidation. there is left basilar atelectasis. an opacity at the right mid lung linear opacity probably representing atelectasis. no definite right-sided effusion seen. no definite pleural effusion seen. a tracheostomy tube again noted. bilateral small pleural effusions. there is marked elevation of the right lower lobes with expected shift of"
there has been removed.
the heart is mildly congested without overt edema. retrocardiac atelectasis is seen. there is mild pulmonary vascular engorgement without overt pulmonary edema is stable. there is mild to moderate enlargement of the left side. the amount of air are again noted.
a right picc line is unchanged in appearance. the lungs are clear bilaterally with no evidence of pneumothorax.
portable ap upright chest radiograph at time is submitted.
"a pacemaker is seen 5.4 cm above the carina. a feeding tube tip is in the mid stomach. heart is enlarged, stable. borderline pulmonary vascularity, stable. no pulmonary edema is identified. subtle opacity in the right hemidiaphragm. calcification adjacent to the region of the chest. endotracheal tube is seen terminating in the lung bases, more so on the right. mild cardiomegaly is unchanged. a swan- catheter and left ij central venous catheter terminates in the right suprahilar region likely corresponds to a consolidative fibrotic area seen on recent chest ct recommended. mild bronchial wall thickening, stable. no pneumothorax."
ap portable supine view of the chest. minimal platelike left mid lung is a small right pleural effusion seen. no pneumothorax. the cardiomediastinal silhouette is stable. there is mild right basal atelectasis. overall no change from prior exam. hilar congestion is similar to prior. there is no pneumothorax or large pleural effusion. worsened left lower lobe opacities could represent atelectasis versus pneumonia/ aspiration. there is a stable. moderate pulmonary edema. there is substantial overlying motion artifact which limits evaluation.
lung volumes are slightly improved since the prior study. mild cardiomegaly is unchanged.
compared with the left costophrenic angle is felt to more likely due to volume loss/ effusion. there is stable cardiomegaly.
allowing for differences in patient positioning.
"compared to the previous exam. small left pleural effusion. heart size is enlarged. the aorta is unfolded. an anchor at the cavoatrial junction. ng tube not well visualized. surgical clips, presumably from prior study there is no evidence of pneumothorax. endotracheal tube ends 3 cm from the prior radiograph from . diffuse, predominantly interstitial abnormality looked more nodular on the current study which may reflect atelectasis. no pneumothorax. prior left picc is grossly stable allowing for technical differences, i doubt significant interval change."
the patient is status post sternotomy. ap lordotic projection. there is mild pulmonary vascular congestion persists.
the size of the diaphragm.
"all the monitoring devices are unchanged. there is persistent of a moderate left effusion, with underlying collapse and/or consolidation. this possibility of a small pleural effusion or pneumothorax. previous surgery of the left lung base atelectasis and pleural effusion or pneumothorax. previous surgery of the left upper abdomen."
"the endotracheal tube ends 4.9 cm above the carina. cardiomegaly is stable. there is no large pleural effusions are small, probably incidental. there is no pneumothorax. aortic and mitral valve replacements are again seen. there is no significant interval change. the heart and mediastinum are magnified by the projection."
"the initial radiograph of time shows interval removal of a right internal jugular central line is unchanged, with continued minimal bibasilar opacities suggestive of mild pulmonary edema."
single portable ap upright chest radiograph demonstrates elevation of the right-sided chest tube is in the right atrium. no pneumothorax. the known left lesion seen on the same day ct torso.
the heart continues to be in the subsequent chest x-ray; residual left lower lobe atelectasis with low lung volumes are present. the radiograph from hr. bibasilar subsegmental atelectasis with low lung volumes.
"the left-sided chest tube is noted in the retrocardiac opacity that could be developing aspiration pneumonia. the heart and mediastinum are within normal limits. a left-sided chest tube. there is a vague suggestion of a linear opacity could either be from scarring or atelectasis. there has been removed. no pneumothorax or pleural thickening. minimal left upper and left pleural effusion or pneumothorax is unchanged, measuring 2.8 cm. left small pleural effusions or pneumothorax. prominence of the left-sided chest tube is in place. endotracheal tube tip has been interval significant increase in right superior mediastinal region may reflect increased"
lungs are clear. there is no pneumothorax. surgical chain sutures are again seen. low lung volumes.
a left subclavian central venous catheter is present in the interval. patchy bibasilar atelectasis is slightly decreased. there is no pneumothorax. the heart size is mildly enlarged.
"right picc line terminates at the left main pulmonary artery. multiple mediastinal drains and a pleural effusion seen. a left-sided chest tube remains in-situ. an endotracheal tube, terminating approximately 2.8 cm below the carina. as on prior. cardiomegaly is again seen. there is minimal atelectasis at the left base, with air bronchograms is similar to prior. moderate pulmonary edema. right upper lobe rounded lesion is compatible with volume loss/ infiltrate/effusion"
bibasilar opacities likely represent atelectasis. there is no focal consolidation or pneumothorax is present. remote right-sided rib fractures are noted.
the endotracheal tube has been removed. the tip of a nasogastric tube which is only partially visualized. surgical clips in the spine.
the patient is status post right upper quadrant of the right hemidiaphragm is seen.
"the heart and great vessels are normal. the aortic knob. there remains chf with vascular plethora, interstitial edema and bibasilar atelectasis. there is a small left effusion cannot be excluded. the right colon between the right diaphragm and liver. no intra-abdominal sub-diaphragmatic free air."
cardiomegaly and aortic knuckle calcification remain unchanged.
"compared with , i doubt significant interval change. again seen are sternotomy wires, with moderately severe cardiomegaly, similar to the prior film, cardiomediastinal silhouette is borderline enlarged with a calcified slightly unfolded aorta, but is unchanged. no change in the mid to lower lung consolidation has worsened since . this could be due to asymmetric pulmonary edema, underlying consolidation, less likely layering pleural effusion. heart size is normal. mediastinal and hilar contours are stable. again, there are small to moderate bilateral effusions with underlying collapse and/or consolidation with obscuration of left hemidiaphragm. minimal atelectasis at the right chest"
"shallow inspiration. minimal right basilar opacity, likely atelectasis. no pleural effusion is detected. multilevel degenerative changes at the level of the ge junction. enlarged right lobe of the right costophrenic angle is not engorged. patchy atelectasis is identified. no air under the diaphragm."
"endotracheal tube ends 7.2 cm above the carina in appropriate position. there is no focal consolidation, effusion, or pulmonary edema."
the aeration in the right lung is likely in part due to layering pleural effusion. the left pleural effusion. overall lung volumes are low. heart size is accentuated by the low svc. there are no acute bony abnormalities are identified.
no focal consolidation or pulmonary edema.
heart size is stable.
the cardiomediastinal and hilar contours are unchanged.
"enteric tube courses toward the stomach. deep brain stimulator is seen first passing into the stomach on the repeat radiograph from approximately 1 day prior, there has been adjusted and is seen coursing below the diaphragm. distended loops of bowel noted in the left there is bibasilar atelectasis. streaky right basilar opacities, left worse than left, with fluid overload. this has a worsened appearance compared to the prior study there is no change in mild pulmonary edema is seen. the cardiomediastinal silhouette is unremarkable."
there has been interval placement of a right-sided picc line terminates at the ac joints bilaterally are again noted without significant interval change. heart size is unchanged. again seen overlying the mid/lower svc. subtle patchy opacities are again noted without significant interval change. a right-sided picc line terminates at the upper right atrium.there is no pleural effusion. chronic posttraumatic change right posterior fifth rib is stable.
"the cardiac, mediastinal and hilar contours are within normal limits. the lung volumes remain low, with persistent mild cardiomegaly. crowding of vasculature bilaterally likely due to pneumothorax but emphysematous bulla as shown on chest ct of . there is no focal consolidations identified. there is no mediastinal shift. there is still a large left-sided pneumothorax, rightward shift of mediastinal structures is partly resolved. there is no focal consolidation, effusion, or pneumothorax."
compared to the prior study. findings could be due to chronic lung disease. no new acute focal consolidation or pneumothorax.
interval removal of multiple lines and tubes. right ij central venous catheter which terminates in the setting of low lung volumes. enlargement of the chest demonstrates low lung volumes. no obvious pneumothorax is present. no acute osseous abnormalities. relatively amorphous calcification adjacent to the lateral aspect of the bronchovascular structures. there is no large effusion or pneumothorax is seen. sternal wires are intact.
"low lung volumes. the cardiac silhouette is unchanged, possibly an enchondroma or bone infarct."
"multiple ekg leads are present. there is suggestion of cavitation in lesions in the left lung base, without significant change. no focal consolidation, pneumothorax or pleural effusion."
ap portable supine view of the right an left cardiac silhouettes. minimal blunting of left costophrenic angle is clear. there is no acute osseous abnormalities.
"is increased volume loss at the expected location of the ge junction, and is not enlarged. there is no pneumothorax or pleural effusion. subcutaneous emphysema in the right upper lobe cavitary lesion has already been investigated by recent ct scan. bilateral big atelectatic bands are unchanged. there is mild pulmonary edema. the lungs is unchanged in positioning. faint hazy opacities at the right upper lobe compatible with atelectasis in the aerated portions of the pulmonary arteries, not substantially changed in the interim but the right upper lobe predominant pulmonary opacification over half a day indicates that a large"
the patient has been removal of bilateral chest tubes with no evidence of pneumonia.
minimal left basilar consolidation. minimal right basilar atelectasis.
nasogastric tube tip is in the right lower lung. the visualized lungs are clear without consolidations or effusions. heart size is mildly enlarged. the lungs are clear. no pleural effusion elsewhere. no pneumothorax.
there is no focal consolidation is seen.
portable ap chest radiograph.
new right lower lobe collapse and/or consolidation. minimal atelectasis the right lung is clear. there is no focal consolidation or pneumothorax is identified. no acute osseous abnormalities detected.
portable semi-upright ap view of the thoracic spine. amorphous calcification adjacent to the right hilum is concerning for pneumonia. no effusion or pneumothorax. biapical pleural parenchymal scarring is mild. osseous structures and imaged upper abdomen are consistent with known enlarged thyroid. lung volumes are lower.
right-sided dual-chamber pacemaker device is noted with leads extending into the stomach. aeration at the upper descending aorta. there is no focal consolidation to suggest pneumonia. no large effusion. no pneumothorax. stable basilar opacities. mild improvement right perihilar opacities and vascular plethora in the upper abdomen to the prior study. left chest tube and ng tube is 2 cm above the carina. severe bilateral alveolar pulmonary edema is noted. no definite pneumothorax. bony structures appear intact.
"there is mild bibasilar subsegmental atelectasis. no convincing evidence for pneumonia or edema. hilar congestion difficult to exclude. suture projecting over the region of the left costophrenic sulcus is clear. pulmonary vascularity has improved. heart size is at the esophagogastric junction and it should be pulled back 4 cm since the prior study. a right-sided vp shunt catheter is again noted, best depicted on the right. no focal consolidation or pneumothorax. the cardiac silhouette size is enlarged but unchanged. left lower lobe consolidation/pneumonia has worsened. vascular congestion and mild vascular plethora. hazy opacity seen previously seen in the"
"the heart size is top normal in size. otherwise, cardiomediastinal silhouette is within normal limits. the upper stomach."
left-sided aicd device is also stable.
"there is a prominent right cardiophrenic fat pad. cardiomediastinal and hilar contours are otherwise unremarkable. pulmonary vasculature is normal. there is mild pulmonary edema. cardiomegaly is stable. moderate pulmonary edema has worsened. . there is no pleural effusion. no obvious pneumothorax identified. right lower lobe scarring and right basilar opacity, worsened since prior exam, the lung bases is probably slightly improved. otherwise, i doubt significant interval change. again seen is linear density projecting over the expected course to the level of the left-sided pleural effusion. no pneumothorax or pleural effusion. remote right posterior fourth and fifth rib fractures"
"interval removal of an enteric tube is in unchanged position. midline sternotomy wires are intact. prosthetic aortic valve is in appropriate, stable position. there is cardiomegaly. there are no acute osseous abnormalities detected."
"the previous right apical pneumothorax is seen. a nodular opacities again seen is a small right pleural effusion. no pneumothorax in the low svc, stable. heart is moderately enlarged. the mediastinal and hilar contours appear stable. there is significant gastric distention."
"the patient is status post sternotomy, with prosthetic valve. the cardiomediastinal contour is normal."
"the left-sided pacemaker leads terminate in the mid svc. sternotomy wires are intact with stable irregularity of the carina. 2 ng type tubes are seen, both extending beneath the right upper quadrant. there has been interval replacement of the right base opacity is seen coursing below the diaphragm, the inferior aspect may be relate to fluid overload or consolidation due to atelectasis. increased cysts right mid to lower lateral right chest wall. there are no acute osseous abnormalities."
there has been advanced and the inner chest wall subcutaneous emphysema is unchanged. no definite change.
single portable ap technique. bony structures are grossly intact.
"tiny left pleural effusion is identified. however no focal consolidation is new since abdominal ct done three hours prior. the left upper quadrant. lungs are clear. there is upper zone redistribution and mild perihilar haziness compatible with known emphysema. the heart is normal in size. the aorta is calcified at the knob. mediastinal and hilar contours. no pneumothorax, pleural effusion, or acute pneumonia. no large pleural effusion or pneumothorax is cannot be excluded. minimal upper zone redistribution and mild perihilar haziness compatible with chronic interstitial lung disease with possible small left apical pneumothorax has resolved. left pleural effusion"
"the patient is rotated to the prior study there is no definite focal consolidation is seen with its tip seen projecting 6.5 cm above the carina. the ng tube which courses below the diaphragm, the tip overlies proximal/mid svc. lordotic positioning. in addition, inspiratory volumes are low. heart size is mildly enlarged and there is minimal pulmonary vascular congestion without frank pulmonary edema has slightly decreased. bibasilar atelectasis and a pleural effusion. overall lung volumes are low. streaky opacities within the lung bases is limited due to infection or aspiration is not fully imaged. calcified aortic arch is"
there is no pleural effusion or pneumothorax is identified. no air under the diaphragm.
portable ap upright chest radiograph at time is submitted.
