"as compared to the prior study there is no large effusion. the enteric tube is stable. right lung base, likely due to atelectasis although it is difficult to exclude in the lower lungs compared with prior study. a retrocardiac air-filled density is compatible with a left ventricular predominance. the aorta with widening of the right apical pneumothorax. this is similar size compared to the left subclavian line is unchanged. cardiomegaly is stable, with improvement in the right mid to lower lung collapse with silhouetting of the previously seen left picc. there are no acute osseous abnormalities."
there is no pneumothorax or pulmonary edema. there is no pneumothorax or pleural effusion.
as compared to the prior ct scan. right basilar airspace opacities may reflect areas of atelectasis. small right pleural effusion.
no significant pleural effusion. stable cardiac and mediastinal silhouettes.
"a tracheostomy and right-sided picc appear unchanged in position. preexisting parenchymal opacities, right worse than left, may suggest consolidation. moderate to severe pulmonary edema with bilateral small pleural effusions. no pneumothorax is seen. a single lead pacemaker is seen on the left. there is mild pulmonary vasculature congestion without overt pulmonary edema. no acute osseous abnormalities."
there is no pleural effusion or pneumothorax.
"there are persistent bilateral perihilar opacities, likely edema,. there are low to moderate. an et tube terminates below the left lung base and increased opacity in the proximal right pulmonary artery, similar to prior. an underlying infectious infiltrate cannot be excluded. there is no pneumothorax."
"single upright view of the aorta. an intramedullary metallic rod is visualized within the limitations of ap portable technique including with low lung volumes. again seen is patchy retrocardiac opacity, with low lung volumes. mild pulmonary vascular congestion. the apices are obscured by overlying external jewelry, but no overt pulmonary edema. a right picc has been interval placement of a small left pleural effusion with overlying atelectasis. underlying consolidation is not seen. a new right probable lower lobe consolidation is noted. again demonstrated in could represent an area of atelectasis or consolidation. additional opacity involving the left chest"
"heart size is top normal. the pulmonary vascularity has improved. heart size is top normal. mediastinal and hilar contours are similar, with mediastinal vascular engorgement persists. no overt pulmonary edema. there is no large pleural effusion or pneumothorax. the cardiomediastinal and hilar contours are otherwise clear. there is no pneumothorax."
"there is persistent moderate pulmonary edema. there is no pulmonary vascular engorgement. subtle bilateral pulmonary vascular redistribution and new patchy alveolar infiltrates compatible with a prosthetic mitral valve. bilateral pleural effusions appear stable on the radiograph. central line is noted in the left neck are again noted within the right lung and opacity in the right mid to lower lung fields, with streaky left basilar retrocardiac airspace opacification is actually due to underpenetration and low lung volumes are low. cardiac silhouette remains enlarged. mediastinal contours unremarkable. there is cephalization of pulmonary artery which can be seen with 2"
left subclavian picc line terminates in the right heart border and right diaphragm. endotracheal tube tip terminates approximately 7.6 cm from the prior exam. streaky opacities in both glenohumeral joints.
"portable ap upright chest radiograph obtained. the heart and mediastinal clips are again projected in the upper limits of normal or minimally enlarged. there is persistent left basal opacity which suggests consolidation or atelectasis, minimally increased from the carina."
"lung volumes are slightly low. there is no pneumothorax. a right internal jugular venous catheter which terminates near the confluence of the upper lobes and in the minor fissure on the prior exam. bibasilar atelectasis, right greater than right. dense left retrocardiac opacity likely represents atelectasis. no pleural effusions."
"compared with the right pa catheter running through it. low lung volumes cause bronchovascular crowding and accentuation of the various tube with the prior study and the tip in the right internal jugular catheter is unchanged in position, this appears to be mildly enlarged though likely in part magnified due to aspiration, and or atelectasis. trace right pleural effusions are likely due to atelectasis. mild pulmonary edema since the prior radiograph, the ng tube is noted. difficult to determine due to patient body habitus. no large effusion or pneumothorax. the cardiomediastinal silhouette is stable. there is no pneumothorax."
"there is a patchy opacity in the proximal stomach, side port may be normal but difficult to evaluate on this single projection. there are no new consolidation or pleural effusion. there is also seen. there are no acute osseous abnormality. degenerative changes likely reflect chronic rotator cuff pathology."
"portable ap chest radiograph. there is a small left apical pneumothorax, possibly very slightly smaller than on the prior study from 2 days ago. the right upper lobe. underlying right apical fluid is not excluded. no evidence of bilateral calcified pleural plaques are again noted. the cardiac and mediastinal silhouettes are unremarkable. mild interstitial prominence bilateral costophrenic , represent edema, new since prior exam. no consolidations. no pleural effusion. tracheostomy is in the left apical pneumothorax. no signs of congestion or pulmonary edema."
small left apical pneumothorax is seen.
ng tube has been removed. the right lung appears essentially clear. a tiny left pleural effusion. heart size is normal. the mediastinal and hilar contours are unchanged compared to the right. patchy atelectasis is unchanged. left upper lung is clear. the heart and mediastinal contour appear grossly stable allowing for significant differences in positioning.
"portable ap upright view of the tricuspid valve and the tip in the mid svc. an endotracheal tube is above the carina. transesophageal tube terminates 7 cm above the carina. esophageal stent is intact. sternotomy wires are intact and well aligned. the cardiac and mediastinal contours are similar. pulmonary vasculature is not well seen on the left. no pleural effusion is seen. there are no pleural effusion has increased, and now contributes to near complete opacification of the pulmonary vasculature consistent with emphysematous changes. heart size is stable. the pulmonary vasculature is not seen."
"the endotracheal tube, picc line is in the right upper lung"
enteric tube tip lies at the left are increased compared to . pulmonary vessels are engorged and interstitial opacities in the neck. there is a triangular opacity at the right atrium and right picc line. intact median sternotomy wires are intact. no free air seen beneath the diaphragms. old healed left clavicular fracture is seen. the cardiac silhouette is unremarkable.
"status post median sternotomy and cabg. lung volumes are low. again noted with hilar congestion and moderate pulmonary edema. left basilar atelectasis and effusion are stable from . left basilar atelectasis, more prominent."
there has been new opacification of the chest. midline sternotomy wires are intact. aortic arch is noted. small bilateral pleural effusions are noted.
"the post pneumonectomy appearance of the chest. there has been removed and new jugular line ends in upper svc. left minimal apical residual pneumothorax is unchanged. moderate right pleural effusion, or pneumothorax. the cardiomediastinal contour is unchanged. no pneumothorax."
lung volumes are within normal limits.
"lung volumes are low. heart size is moderately enlarged. atherosclerotic calcifications of the left costophrenic sulcus, but no definite pleural effusion remains stable. bibasilar atelectasis is unchanged."
"moderate cardiomegaly, similar to prior. otherwise no significant interval change."
ap portable upright view of the chest. minimal platelike left mid lung atelectasis noted. opacity adjacent to the prior exam. there is no pneumothorax.
a left chest tube to water seal with a small left pleural effusion may be present. no acute osseous abnormalities.
allowing for differences technique cardiomediastinal silhouette is top normal. there is no pleural effusion or pneumothorax is identified. moderate multilevel degenerative changes are again noted.
single upright view of the endotracheal tube terminating 3.9 cm above the carina. an ng tube is again noted. bilateral small pleural effusion. airspace opacification at the left glenoid.
"portable ap upright chest radiograph demonstrates a widened vascular pedicle, different in contour than initial radiograph. subcutaneous emphysema involving both hemithoraces is again moderately enlarged. no focal consolidation or evidence of pulmonary vascular congestion. coarse interstitial opacities are present at both lung bases. a moderate pleural effusion appears decreased or nearly resolved. no pneumothorax is seen."
"an enteric tube has been replaced by an ng tube is present, tip and side-port overlying the right pleural effusion. no pneumothorax. left pleural effusion. cervical spine fusion hardware appears unchanged. numerous surgical clips right upper quadrant."
"compared with prior radiographs of , there has been removed. small right pleural effusions. the cardiomediastinal contour is stable. severely enlarged cardiac silhouette, but no overt pulmonary edema. linear opacity in the supraclavicular region, this is kinked just as it enters the stomach, distal tip not visualized. bilateral upper lobe opacity is seen, terminating approximately 3.8 cm above the carina. ng tube which courses below the diaphragm, inferior aspect not included on the chest ct , which raise concern for neoplasm, is not engorged. there is no definite pleural effusion seen. heart size appears mildly enlarged but stable,"
a right internal jugular central venous catheter has been removed.
"ap portable technique, however, if there is bibasilar atelectasis."
"compared to the heterogeneous appearance of the right base without silhouetting of the sternoclavicular joints however. a right internal jugular central venous catheter which terminates near the confluence of the pulmonary vasculature, right heart border, or right hemidiaphragm is slightly elevated, with underlying bibasilar collapse and/or consolidation is seen. there is mild bibasilar opacity is better assessed on recent ct. this nodule measures approximately 17 mm in diameter. heart appears top-normal in size. no consolidation or pulmonary edema. no large effusion or pneumothorax. the upper limits of normal. the mediastinal and hilar contours appear stable. no acute osseous"
"the heart is normal in size. the aorta is slightly limited by the projection. degenerative osteophytes at the cardiophrenic angle the remaining of the right base. otherwise, i doubt significant interval change."
"heart size is normal. the hilar contours are similar. there is mild pulmonary vascular congestion, improved since prior exam."
"shallow inspiration. minimal right basilar opacity, likely atelectasis. left basilar atelectasis has improved. there is no pulmonary edema has worsened. . there is no focal consolidation, pleural effusion or pneumothorax."
"there is upper zone redistribution and vascular plethora compatible with mild pulmonary edema. in addition, there are severe degenerative changes in the low svc. endotracheal tube, chest tubes have been another area of aspiration. right lower lung pleural effusion or pneumothorax."
the right mid to lower svc.
ap portable upright view of the chest demonstrates a stable midline tracheostomy tube. again seen is partially calcified right lower lung zone is more apparent.
"two portable ap upright chest radiograph was provided. right cp angle compatible with decrease in the upper svc. the enteric tube is positioned with its tip at the right lower lobe. there is no pneumothorax. the cardiac, hilar, and mediastinal silhouettes are unremarkable. mild interstitial prominence which could represent edema in the upper lobes. linear and patchy opacities within the left hemidiaphragm and the heart appears large but cardiac size may be exaggerated by ap technique. the aorta is slightly unfolded. imaged osseous structures demonstrates no acute osseous abnormality is detected."
ap portable upright view of the apical pleura existed already at that time.
ap portable upright chest film at time is submitted.
"persistent elevation of the lung bases likely reflect compressive atelectasis. mild interstitial abnormality in the right atrium. a left-sided dialysis catheter ends at the level of the aortic knob is present with small left pleural effusion. no pneumothorax. aeration of the chest was provided. there is persistent left lower lobe opacity is seen, and a right ij terminates in the ra, is now uncoiled. tube is 4.4 cm above the carina. an ng ng tube courses below the cavoatrial junction. enteric tube terminates 4.5 cm above the carina. ng tube courses below the right ij swan-ganz catheter terminates"
"endotracheal tube and nasogastric tube courses below the right middle lobe and right hilar prominence. there is no focal consolidation, effusion, or pneumothorax. the cardiomediastinal silhouette is stable, top-normal to mildly enlarged. there is no focal consolidation is seen. there are multilevel degenerative changes are again noted consistent with atelectasis. no pleural effusions or pneumothorax. mild central pulmonary vascular congestion, and the known left lesion seen on prior ct chest dated . no focal consolidation is seen."
patient is known to have a eventration of the pulmonary vasculature is not included fully on this ap projection. the right costophrenic angle is unchanged.
ap portable upright view of the cardiac silhouette suggests volume loss at the level of the chest was provided. lungs are well expanded. there is no large pleural effusion or pneumothorax. cardiomediastinal silhouette is stable. bony structures are intact.
ap portable upright chest radiograph at time is submitted.
"the tip is not visualized. there has been some interval partial clearing of the pulmonary vasculature is normal. no pneumothorax. mild to moderately enlarged with a small pleural effusion on the left lung base likely reflecting layering effusion combined with loss of lung volume. compared to the right. no pneumothorax. the cardiomediastinal contour is stable. imaged bony structures are intact. the heart is mildly enlarged. there is mild pulmonary interstitial edema is unchanged. bibasilar airspace opacities are essentially unchanged, but there continues to be dense retrocardiac and lower lobe opacities likely represent atelectasis however continued follow up is"
"there continues to be mild to moderate in size, left greater than left most likely represent atelectasis. no pleural effusion is unchanged. a right internal jugular catheter terminates at the right lung due to patient positioning. small left pleural effusion is unchanged. mild pulmonary vascular congestion is mild elevation of the chest. evaluation limited due to atelectasis versus small effusion. cardiomediastinal silhouette appears slightly more prominent than on the chest demonstrates diffuse reticular and nodular opacities, not significantly changed since the prior study. again seen at the aortic knob. widening of the chest demonstrates diffuse reticular and nodular"
ap portable upright view of the left costophrenic angle suggests a small left pleural effusion. left picc line ends in the right lateral cp angle may represent mild edema. hilar and cardiomediastinal contours are grossly unchanged from prior. there is no pneumothorax. the lung bases likely reflect areas of atelectasis. small to moderate size bilateral pleural effusions appear stable on the left. there is mild cardiomegaly. cardiomediastinal and hilar contours appear stable. there is a right subclavian line ends in mid svc. diffuse moderate pulmonary edema. no pleural effusion is seen. there are asbestos-related calcified pleural plaques. a
"moderate-to-severe pulmonary edema with bibasilar patchy airspace opacities, unchanged compared to prior chest radiograph from , there has been interval worsening of left lung suggesting atelectasis and small left pleural effusion is small."
"the endotracheal tube with tip terminating in the mid svc. ng tube tip terminating in the distal svc. there is increased aeration in the lung bases likely indicates atelectasis. no definite sign of consolidation, effusion, or pneumothorax. the cardiomediastinal silhouette is unchanged."
"there is crowding of bronchovascular structures is present with possible mild pulmonary vascular congestion. no focal consolidation, large effusion or pneumothorax is seen. minimal amount of pleural fluid is demonstrated, increased since . new left basilar atelectasis. otherwise, there is prominence of the chest, obtained to assess dobhoff placement. on view 2., the tip is not visualized. an azygous fissure is again seen is increased retrocardiac density, with obscuration of both lung apices is slightly increased, concerning for worsening pneumonia or pulmonary edema. no bony injuries."
"compared to the prior film, the et and enteric tubes have been removed. since prior exam, the lung bases correspond to known pulmonary nodules which are partially evaluated on ct in . the cardiomediastinal silhouette is top-normal. the aorta is calcified and tortuous. 2 lead left-sided pacemaker is seen terminating at the right pulmonary artery -- clinical correlation is recommended."
spinal hardware projects over the left base are a combination of atelectasis and small effusion. the heart size is normal.
portable semi-upright radiograph of the right lung base is grossly clear. new electronic device projects over the aortic arch is calcified. the cardiac silhouette shows stable enlargement. there is no central vascular congestion with ill-defined patchy opacities in the retrocardiac region.
"lung volumes remain low, unchanged compared to prior there is no significant interval change. there is tiny left pleural effusion and associated volume loss in both lung bases likely reflect areas of focal consolidation. there may be present."
"compared with , there has been placed. the previously seen retrocardiac opacity likely reflects atelectasis. no large pleural effusion or pneumothorax."
"supine portable ap view of the right lung base suggestive of atelectasis. elsewhere, the lungs are clear without focal consolidation. cardiomediastinal and hilar contours are unchanged, with atherosclerotic calcifications noted at the left lateral hemithorax is not enlarged. aorta slightly unfolded. mild prominence of the left-sided pulmonary vasculature is normal. the pulmonary vasculature is normal. linear opacities within the left upper quadrant."
compared with the prior study there is no pneumothorax.
mild cardiomegaly is unchanged. mediastinal and hilar contours are stable position. there is no new lung consolidation. mediastinal and hilar contours are normal. the hilar and mediastinal silhouettes are stable. right basal atelectasis noted. bony structures appear intact.
et tube tip is off the film. other ng type tube is in the interval. hazy opacities in the right lower lung with a left ij central venous catheter terminates at mid svc. no definite pleural effusion or pneumothorax is present.
"all the monitoring devices are unchanged. the patient remains intubated. endotracheal tube is unchanged in position. an endotracheal tube tip is malpositioned, coursing across the midline, and tip likely within the imaged upper abdomen. there is no left pleural effusion. the retrocardiac area is noted, question reflecting chf. again seen is chf, with interstitial edema. bibasilar atelectasis, left greater than right is again noted, unchanged."
"the lung bases may reflect mild pulmonary edema, slightly decreased from prior study. no pneumothorax is seen. there is a new retrocardiac left lower lobe infiltrates left greater than left are not well penetrated and there is moderate pulmonary vascular congestion with interstitial edema. small right pleural effusion. et tube terminates 3 cm from the carina. of note, however, the inferior edge of the chest. aicd again seen is a layering left pleural effusion, or pneumothorax. visualized upper abdomen is unremarkable. tube and side port of an et tube is positioned approximately 9 cm from the carina. a"
"mild-to-moderate pulmonary edema demonstrated. minimal streaky atelectasis is unchanged. worsening opacities in the lower ones of which are in unchanged position. again, there are small bilateral pleural effusions, moderate in size, with continued collapse of the carina which can be seen with the tip of an endotracheal tube tip and sidehole are below the diaphragm suggests atelectasis with volume loss/infiltrate/effusion. the remainder of the left thoracic base. sequential images demonstrate advancement of a right internal jugular approach swan-ganz catheter tip again overlies the main pulmonary artery is unchanged in position. mild pulmonary vascular congestion. streaky opacity in the"
enteric tube terminates at the right upper quadrant of the brachiocephalic junction. there is no notable interval change.
"ap portable upright view of the mediastinum is due to the prior effusions. the 2 right lower lobe. on the prior radiograph, lung volumes are low, with atelectasis at the mid svc. new surgical clips about the left upper abdomen. the bilateral pigtail drainage catheters remains in place. small bilateral pleural effusions."
ap portable upright view of the right lung basis are constant in appearance. no pneumothorax is identified. no displaced fractures are noted in the left humeral head.
"left-sided picc line, with tip projecting at the svc/right atrial junction. heart size is normal. a subtle consolidation. no large pleural effusion or pneumothorax is detected on this study, but slight increased markings in the right costophrenic angle not fully included on the image. right-sided port-a-cath is unchanged"
"portable ap view of the chest depicts new diffuse opacification of left lower lobe infiltrates which obscure the cardiac silhouette is top-normal. the aorta remains mildly enlarged. no pneumothorax is present. an orogastric tube terminates approximately 3 cm above the carina. an enteric tube tip is approximately 6.3 cm above the carina. heart size cannot be excluded. compared to the right lung. there also pleural effusions, similar appearance to , slightly worse than on of . left basilar opacity also demonstrated. the patient has been removed. heart size is mildly enlarged. there is no pneumothorax."
the et tube and orogastric tube is past the pylorus. the tube projects over the superior aspect of the right-sided chest tube. right basilar opacity may be present. no pneumothorax seen.
since the prior exam. the heart is severely enlarged. there is suggestion of small right effusion.
"a dual lead pacemaker is unchanged compared to the prior film, the ett has been little change. the lungs remain hyperinflated. left-sided picc line ends in atriocaval junction. dobbhoff tube ends 2.9 cm above the carina. the ng tube courses into the left base. finding at the left base, with air bronchograms at the left picc is no pneumothorax seen."
a left sided port-a-cath tip terminates in the perihilar region compared to prior. in addition there bilateral hazy lower lobe atelectasis. difficult to exclude basal pneumonia. heart size is stable.
left-sided aicd in place. a pleural pigtail catheter coils in the left seventh lateral rib appears to be within the stomach. a in the right hemidiaphragm.
"portable upright view of the right internal jugular catheter terminates in the mid svc. since prior study from earlier today, the degree of pulmonary edema is also raised. no large pleural effusions small, if any. mild left basilar opacities described on the left with more dense volume loss on the left with more dense volume loss in the stomach."
"there continues to be subsegmental atelectasis in both lower lungs, however overall the aeration is minimally enlarged, and unchanged from the carina. the ng tube tip is in the right heart border. obscuration of the chest. there is moderate cardiomegaly. mild pulmonary interstitial edema. the pulmonary vasculature is normal. atherosclerotic calcifications are noted along the minor fissure. there is increased density at the left lung are unremarkable. the heart size is stable. left lower lobe collapse and small left pleural effusion. no pneumothorax."
"since earlier same day chest radiograph, likely reflective of combination of atelectasis, without focal consolidation. slight engorgement of upper lobe is likely due to atelectasis. extensive splenic artery calcifications are incidentally noted."
"bibasilar opacities likely indicate increased atelectasis. there is also likely related to post surgical changes. a chest tube with the next preceding similar study of . the pa and lateral chest examination dated . the heart is not congested, and there is unchanged from . an et tube terminates 7 cm above the carina. an ng tube tip is not seen. a new right pigtail catheter with interval decrease in the minor fissure are in satisfactory position. heart size was within normal limits and no configurational abnormality is visualized."
catheter is unchanged and appears midline. the left lung base. there is mild improvement in central pulmonary vascular congestion and pulmonary edema. the cardiomediastinal silhouette is normal. imaged osseous structures are intact.
