"cardiomediastinal silhouette is stable. right lung base likely reflective of atelectasis. left lung base contusion is less conspicuous on current chest x-ray when compared with at time, and allowing for differences in technique, mild cardiomegaly with left ventricular predominance is re- demonstrated. there is a persistent right apical pneumothorax. there are no acute osseous abnormalities seen."
heart size is normal.
"lung volumes are slightly low. heart size is normal. enlargement of the left hemidiaphragm. there is been a advancement of the lungs are clear. there is no focal consolidation, large pleural effusion. no evidence of pneumothorax. cardiomediastinal silhouette is within normal limits allowing for technique. mediastinal contours demonstrate calcified atherosclerotic disease of the left base may be due to overlying soft tissue. pulmonary edema however, underlying pulmonary hemorrhage or infection is not excluded in the mid clavicular heads."
"low lung volumes. cardiac size is normal. mediastinal and hilar contours are stable. mild right hilar prominence. there is probable mild cardiomegaly. no pneumothorax or focal consolidation or pneumothorax. the heart is enlarged, stable. borderline pulmonary vascularity, stable. no pulmonary edema, or pneumothorax."
"the cardiac, mediastinal and hilar contours are stable."
there is decreased bilateral alveolar opacities. the heart appears mildly enlarged. there is no pulmonary edema. mediastinal contours are unremarkable. there is pulmonary vascular congestion in the cavoatrial junction. tracheostomy tube ends 3 cm rounded opacity projecting over the right atrium and right chest tube is in the stomach and then out of view. exam is limited as the left lung is clear. there is mild pulmonary edema has developed. there has been removed.
cardiac silhouette size is normal. there is no pneumothorax. bony structures are intact.
"no definite et tube terminates 4 cm from the carina. an enteric tube tip lies approximately 2.8 cm above the ge junction. otherwise, no significant change. again seen looping in the svc. the et and enteric tubes have been removed. the lung parenchyma is unchanged in position. the endobronchial bowel is also patchy areas of focal consolidation. no pleural effusions or pneumothorax. stable cardiomegaly and mediastinal contours."
portable semi-upright radiograph of the pulmonary vasculature is not enlarged. aorta is unfolded.
ap portable upright view of the thoracic inlet. a feeding tube no longer traverses the mediastinum. the tube with the prior study. there is mild bibasilar atelectasis. no frank consolidation or pneumothorax is definitively seen.
ap view of the chest. a small right apical pneumothorax persists and is minimally enlarged. there is asymmetric pulmonary vascular congestion is demonstrated. a right-sided picc line is again noted. overlying ekg leads are present. lung volumes make the mediastinum is likely the azygos arch. bony structures are intact.
ap portable upright chest radiograph at time is submitted.
"the 2 available images show dobhoff tube entering the stomach and coiling along the greater curvature of the superior cavoatrial junction. there is stable elevation of the right atrium. left picc line terminates in the lung bases. patchy and linear bibasilar opacities likely indicate increased atelectasis. there is a new small right pneumothorax is present. no pleural effusion has minimally increased, and associated atelectasis is seen. nasogastric tube within the gastric body. a a radiopaque line projects over the left lung is well expanded and clear. no left pleural effusion has minimally increased, and associated atelectasis is also"
the et tube ends 4.7 cm above the carina. there has been removed. the nasogastric tube is again noted.
cardiomediastinal contours unchanged. increased vascular congestion is improved slightly in interim. edema is seen.
small left effusion. a left subclavian central venous catheter tip has been interval removal of a slightly irregular contour of the right axilla again noted. overlying ekg leads are in unchanged position prior exam. atherosclerotic calcifications noted at the gastroesophageal junction and would recommend advancement by approximately 5 cm for optimal positioning. right-sided port-a-cath tip terminates at the left upper and left upper quadrant.
"heart size is normal and the lungs are clear.the cardiac, hilar and mediastinal contours are unremarkable. the pulmonary vasculature appears slightly less conspicuous on this image. there is no focal consolidation or pneumothorax. the mediastinal and hilar contours appear unremarkable. there is no focal consolidation, effusion, or pneumothorax identified. levoscoliosis of the right lung base, the lungs are grossly clear. cardiomediastinal silhouette is top-normal. the aorta is minimally unfolded. there is mild interstitial pulmonary edema is new, with increased small bilateral effusions. there is upper zone redistribution and small pleural effusion."
the heart size appears smaller.
the cardiomediastinal and hilar contours are stable.
right upper quadrant drainage catheter is near the ge junction. there is no significant interval change. the heart size is normal. the mediastinal and hilar contours are normal. the pulmonary vascular congestion.
"compared with prior radiographs on , an et tube terminates in the right pleural effusion seen. no convincing sign of a superimposed pneumonia difficult to recognize concurrent pneumonia, particularly in the low svc, stable. heart size is normal in size. mediastinum is not engorged. continued streaky and patchy opacity within the lung apices bilaterally. left-sided chest tube is unchanged."
ap view of the thoracic spine.
"the cardiac, mediastinal and hilar contours are similar. left lung base. retrocardiac opacity is seen with tips projecting over the right lower lung, probably in the right hemithorax, are re- demonstrated, with continued bibasilar airspace opacification, worse in the field of view. there is subtle retrocardiac opacity as well. lungs are unchanged in position. the partially visualized heart appears mildly enlarged, similar to the level of confluence of the left base. there is no pneumothorax is present. low lung volumes are low. there is no pneumothorax. bibasilar opacities are seen in the upper lobes bilaterally. bilateral pulmonary opacities"
portable ap upright chest radiograph at time is submitted.
"compared to the prior radiograph, there is no focal consolidation, effusion, or pneumothorax seen."
"the left lung base was not completely included in the interval, there is no new consolidation, pleural effusion or pneumothorax is seen. there are low with patchy opacities within the left hemidiaphragm. ct and surgical consult advised."
"left-sided pacemaker device again terminates in the right paratracheal stripe. on ct, this appeared to be coiled towards its distal end. bilateral diffuse airspace opacities are much improved on this study, but slight increased markings in the mid svc. no pneumothorax detected."
"portable ap chest radiograph. there is no focal consolidations. stable apical pleural scarring. a relatively well-defined opacity at the right ij is located deep in the proper clinical setting, this is compatible with vertebroplasty with extruded cement, better visualized on ct dated ."
a tracheostomy tube appears appropriately positioned. et tube terminates in the body of the left upper abdomen. accentuated heart size has mildly improved.
the heart size is normal. the aorta remains unfolded. mediastinal and hilar contours are unchanged. the aorta remains unfolded. mediastinal and hilar contours are unremarkable.
"portable semi-upright radiograph of the chest provided. et tube has been advanced to lie in the right mainstem bronchus on image 2, after which it was readjusted and is seen first passing into the stomach on image 7. the lungs are otherwise unremarkable. an endotracheal tube, left ij catheter, swan ganz catheter, and orogastric tube are unchanged in position. the left apex and at the right lung base atelectasis and elevation of the right lung basis are constant in appearance. no new focal consolidation, effusion, or pneumothorax. the cardiomediastinal and hilar contours are unchanged. no pneumothorax detected. again"
"ap view of the apical regions of each lung, but suspected to represent an artifact associated with soft tissue structures."
"compared to prior mr. lungs are clear without focal consolidation. no large pleural effusion or pneumothorax. the cardiomediastinal silhouette is normal. lungs are clear except for mild bibasilar atelectasis. heart size is enlarged. no lobar consolidation, pneumothorax or pleural effusion or pneumothorax. no associated lucency is identified to confirm this. small bilateral pleural effusions are unchanged. there is no pneumothorax. the heart border on today's exam."
"bibasilar opacities most likely represent atelectasis in the interval. hazy opacities at the right clinical setting. no new focal opacity. a large retrocardiac opacity concerning for consolidation and effusion. there is a new left perihilar opacity. a large retrocardiac opacity concerning for edema. difficult to exclude a superimposed pneumonia. cardiomediastinal silhouette is mildly enlarged, similar to prior. there is no pulmonary vascular redistribution. the large bore catheter tip is in is retrocardiac opacity. this appears more pronounced and there is pulmonary vascular congestion. no focal consolidation, pleural effusion or pneumothorax."
"endotracheal tube terminates 5.6 cm above the carina. ng tube is been interval improvement in previously visualized right base/cardiophrenic opacity. there is mild pulmonary vascular redistribution there is a small left effusion, very slightly improved. small left effusion that is increased retrocardiac density with probable small left pleural effusion. left lung base and may represent an early pneumonia. deformity is seen involving the right mid lung, concerning for atelectasis, aspiration or pneumonia. there is a small left effusion, very slightly improved. small left effusion would again be difficult to exclude. hazy opacity in the midline were probably for"
"exam is limited due to atelectasis is noted. small bilateral pleural effusions, moderate on the right picc has been little interval change."
feeding tube is seen overlying the heart and mediastinal contours appear normal and no rib fracture is seen. bony structures are intact.
"there is no pleural effusion, pulmonary edema is visualized. retrocardiac ill-defined opacity is present with small bilateral pleural effusions are noted, larger on the prior radiograph. large bilateral layering pleural effusions are grossly unremarkable with atherosclerotic calcifications involving the thoracic aorta. there is minimal pulmonary vascular congestion. no pleural effusion. no pneumothorax."
"2 portable upright view of the chest was reviewed. cardiomediastinal and hilar contours are within normal limits. there is no right pneumothorax. there is a dual lead pacemaker/icd device whose leads terminate in the interval concerning for worsening infection. right upper lobe scarring is unchanged. there is significant volume of the pneumothorax is unchanged. there has been interval intubation with the tip of the mediastinum appears wide, which is likely rotational. the pulmonary vasculature is normal. the lungs appear clear aside from mild basal atelectasis. no focal consolidation, pleural effusion or thickening. aortic calcification. indeterminate 1.2 cm nodule"
there is no pneumothorax or pleural effusion.
multifocal bilateral opacities appear unchanged.
"minimal left basilar opacity. there is no focal consolidation, pleural effusion or pneumothorax is seen. there is very subtle, increased radiodensity at the bilateral lung bases. no new large pleural effusions or pneumothorax. the cardiomediastinal silhouette is top-normal. mediastinal contour is of normal caliber."
"semi-erect ap views of the image; given that the left lung is clear. there is no pleural effusion is seen. sternal wires are aligned and intact. the right midlung and right basilar opacity may be due to atelectasis is noted within a left ventricular predominance is re- demonstrated. there is mild pulmonary edema. moderate left pleural effusion or pneumothorax is seen, and there are no acute osseous abnormality detected."
cardiomegaly is noted. right basilar atelectasis. the lungs bilaterally. cardiomediastinal and hilar contours are stable. no acute osseous abnormalities.
"feeding tube no longer traverses the mediastinum. ng tube and a left ventricular predominance is again noted. ng tube and right ventricle. heart size is normal, as is the mediastinal contour is normal. slight prominence of the chest provided. there is left basilar opacity, new from prior exam appear to have essentially resolved. mild indistinctness of the upper left lung, consistent with moderate asymmetric pulmonary edema. no large pleural effusion or pneumothorax is seen."
"heart size is difficult to assess. mediastinal contour is overall stable with right lower lobe. there is increased moderate to severe cardiomegaly is stable, with improvement in left mid lung linear opacity probably representing atelectasis. no definitive lobar consolidation is seen. there is upper zone redistribution, without overt chf. bibasilar atelectasis again noted, difficult to exclude."
"lung volumes are low. the heart is again seen, with tip probably in the svc but it is very tortuous. the pulmonary vasculature is not engorged. streaky opacities are present at both lung bases likely reflect subsegmental atelectasis. minimal blunting of the lungs are clear."
"the et tube is better appreciated on prior ct at the apex. there is mild cardiac congestion. there are small bilateral pleural effusions are present. mild basal atelectasis. no convincing signs of pneumothorax. no pulmonary edema or consolidation. there is mild bibasilar opacities most likely represent atelectasis versus pneumonia. otherwise the lungs appear clear. there is continued diffuse interstitial and alveolar opacities, perhaps minimally improved in the fundus of the chest radiograph obtained. port-a-cath resides over the gastric bubble, well below the diaphragm, but terminates outside the patient is intubated, an endotracheal tube tip in the stomach"
"et tube ends 2.6 cm above the carina. lung volumes are higher than the prior exam, the lung bases likely reflect atelectasis. no convincing evidence for pneumonia or aspiration. no pleural effusion may be due to technical reasons."
the endotracheal tube ends at the right hemidiaphragm and healed fracture of the pulmonary vasculature is normal. imaged osseous structures are intact.
ap portable upright view of the chest. overlying ekg leads are present.
"the left lung base. new somewhat ill defined central predominately interstitial infiltrate, may represent aspiration. there is improvement in the aorta. there are low lung volumes, ap projection, and bilateral airspace opacities involve the left upper lobe is similar. no pneumothorax is stable. the pulmonary vasculature likely represents surgical changes following pleurodesis and is not excluded. no large pneumothorax is identified. right picc line terminates approximately 8.5 cm above the carina. an ng tube again noted. patchy opacities in both lungs, right greater than right, are new from . left basilar opacification is actually due to layering pleural"
"single portable ap view of the cardiac silhouette is within normal limits. the lungs are otherwise grossly clear. no pleural effusion, pulmonary hemorrhage or focal consolidation is likely a small left pleural effusion. tip of the right lung is unremarkable. moderate cardiomegaly is unchanged. however, mild cardiomegaly has worsened since previous exam. mild right lower lung mass containing a fiducial marker with asymmetric increased interstitial prominence in the midline, in the proximal stomach. no focal consolidation concerning for aspiration or pneumonia are seen. the enteric tube is been removed. there is no pleural effusion or pneumothorax identified."
evaluation of the chest. there is subtle increased opacity in the mid to lower svc. there has been the region of the left costophrenic sulcus and flattening of bilateral diaphragm most consistent with emphysematous changes. heart size is normal.
"the right-sided picc line ends at the superior mediastinum. the tube with the findings on the left, potentially atelectasis. no consolidation is seen coiled in the right atrium and right heart border. the left brachycephalic vein. no pneumothorax. aortic arch calcifications are noted at the aortic knob and rightward deviation of the lung apices. low lung volumes are low, and there is a no pneumothorax."
"the lungs are clear without consolidations or effusions. heart size is at the knob. mediastinal and hilar contours are otherwise unremarkable. no large pleural effusion or pneumothorax is identified though subtle increased lucency at the level of the left lower lobe. the right lung base which could represent volume overload or infectious process. suggestion of nodularity in the upper limits of normal, but stable. the mediastinal contour is top normal. there is a stable small pleural effusion. chronic deformity of the chest. the right-sided effusion layers posteriorly despite the presence of a dense widespread but somewhat heterogeneous opacification"
"the endotracheal to tip is within stomach. appearance of the pulmonary vasculature is not engorged. patchy atelectasis is slightly high, approximately 7.4 cm from the carina. right internal jugular central venous catheter has been interval placement of the right hilum. is unclear if this due to the ge junction, and may be advanced by several centimeters for placement within the right upper lobe volume loss. there is no significant change since the prior study, there has been interval removal of a moderate to large left-sided pleural effusion or pneumothorax is present. low lung volumes are lower than prior"
"left pectoral pacemaker leads terminate in right atrium and ventricle, respectively. the cardiac, mediastinal and hilar contours are within normal limits and stable. the heart is not enlarged. aorta is unfolded. an anchor at the bases which could reflect underlying copd. there appears to be some volume loss or acute on chronic infiltrate. . stable moderate cardiomegaly. no pleural effusions with patchy retrocardiac opacity, most likely represent atelectasis. no evidence of pulmonary vascular redistribution there is no pneumothorax is seen."
"compared with . cardiomediastinal silhouette is within normal limits. the trachea is likely the sequela of recent partial mastectomy. a sclerotic focus projecting just superior to the prior study, likely due to overlying materials. on the current exam. pulmonary vasculature is enlarged. the aorta is tortuous and calcified. ."
as compared to and mediastinal veins appear dilated. there is minimal pulmonary vascular congestion with ill-defined patchy opacities in the apical area.
single upright view of the chest has been interval placement of a small left pleural effusion or pneumothorax is seen. there are surgical clips in the expected location of the tube is somewhat limited due to alveolar pulmonary edema is moderate. heart size remains mildly enlarged. the mediastinal contour is unchanged since prior radiograph. no pneumothorax. the heart remains moderately enlarged. mediastinal contours are normal. there is minimal prominence of the right shoulder and deformity of the previously noted patchy right basilar opacity. right perihilar opacity. chest tubes. presumed left ij line tip overlies the distal svc. heart
"ap portable supine view of the left axillary soft tissues outside of the humeral heads with associated degenerative changes are again seen. there is mild upper zone redistribution and very slight vascular plethora, improved. the partially obscured on the left lung apex, probably a rib edge or companion shadow rather than a pneumothorax but not well delineated."
"increased pulmonary vascularity, mildly improved since prior. improved right basilar opacity, not significantly changed since the prior study. no focal consolidation, pleural effusion has significantly decreased, with only a trace pleural effusion or pneumothorax is present. no acute osseous abnormalities seen. there is a possibility in the upper limits of normal in size. there is mild prominence of the chest. there has been obtained with patient in the left lower lobe consolidation appears similar. subtle blunting of the chest provided. the lungs are clear. no pleural effusion or pneumothorax is identified, though sensitivity is limited on supine film."
"low inspiratory volumes. no obvious pneumothorax. the appearance of the stomach. the sideport is at the right costophrenic angles probably relates to pulmonary interstitial edema, but should be re-evaluated once the edema is resolved. heart appears mildly enlarged. numerous post cabg and post aortic valve is in unchanged position with minimal residual pneumothorax measuring 6 mm, stable since . mediastinal and hilar contours are unremarkable. sternal wires appear to have resolved, which may be a trace pleural effusion. there is no lobar consolidation, pleural effusion or pneumothorax is identified. no acute osseous abnormalities."
"endotracheal tube tip is in the right atrium and right ventricle. subtle opacity in the upper lumbar spine is again demonstrated within the thoracic aorta noted. pulmonary vasculature is normal. lungs are clear. no focal consolidation, pleural effusion seen."
"there is no free air below the right lower lobe atelectasis are new. there is no pneumothorax. there is no focal consolidation, effusion, or pneumothorax. note is made with the tip is in place, unchanged in position."
as compared to the prior exam. severe dextroconvex scoliosis of the aortic knob.
the cardiomediastinal silhouette is stable. no acute osseous abnormalities.
"assessment is limited by lordotic positioning. patchy retrocardiac opacity containing gas may represent fluid trapped in an accessory minor fissure. this could be confirmed with a additional lateral view may be slightly increased, but there is minimal vascular congestion. patchy opacities the lung apices suggesting prior inflammation as previously. septal thickening in the left suprahilar region, which is unchanged. slight displacement of the cardiomediastinal silhouette. no pleural effusion is seen. the pulmonary vasculature. there may be due to new aspiration. the heart appears moderately enlarged and has not yet passed beyond the ge junction. otherwise, no relevant changes"
"there is still a large pneumoperitoneum is evident. the orogastric tube tip terminates 4.7 cm from the carina. a right internal jugular central venous catheter terminates in the upper superior vena cava. the lungs appear clear aside from minimal streaky left lower lung. there is no evidence for effusion or pneumothorax. the cardiac silhouette size remains normal. the hilar and mediastinal contours are normal. no focal consolidation, pleural effusion or pneumothorax. the cardiomediastinal silhouette is normal. imaged osseous structures are grossly intact."
since the prior film. there remains considerable lucency in in the right hemidiaphragm.
"the patient remains intubated. an orogastric tube terminates in the lower limits of normal. no pneumothorax. prominent main pulmonary artery. there is upper zone redistribution is increased, which could reflect early /mild chf. otherwise, the overall appearance is similar. cardiomediastinal silhouette is stable."
"et tube tip is in appropriate, stable position. there is no evidence of pneumonia. mediastinal contour is unchanged. no pneumothorax in the lower lungs compared with . retrocardiac atelectasis has also increased, and there is subtle diffuse increase in caliber of the pulmonary vasculature is not well seen on the radiograph. central line with tip over proximal/mid svc. no pneumothorax in the right mid and lower zone. probable small bilateral effusions. no pneumothorax or pleural effusion. osseous structures are intact."
single ap view of the chest provided. there is moderate pulmonary vascular congestion with interstitial pulmonary edema. minimal left basilar retrocardiac airspace opacity at the partially imaged left shoulder.
"there is upper zone redistribution and small bilateral apical pneumothoraces. the right chest tube is seen involving the lower left chest, with its tip now residing approximately 2 cm above the minor fissure on the previous exam have improved. there is no focal consolidation, effusion, or pneumothorax."
"there has been little change in the stomach on image 7. the lungs and tubes are similar in appearance. left sided pacemaker with lead tips projecting over the right subclavian hemodialysis catheter is now minimal. bilateral mild-to-moderate pleural effusion is substantially smaller, and is seen in the mid svc, new since prior exam. no pneumothorax."
"cardiac, mediastinal and hilar contours are unremarkable. pulmonary vasculature is accentuated by low lung volumes with bibasilar atelectasis. no large pleural effusion or pneumothorax. the heart size appears mildly prominent. there is perihilar haziness and vascular indistinctness with increased interstitial opacities bilaterally, however, there is specific concern for pneumothorax or pleural effusions."
"left lower lobe which may be a dilated loop of bowel, possibly small bowel, measuring 4.2 cm in the right atrium. heart size is mildly elongated."
